id,section,question,correctAnswer,choice1,choice2,choice3,points,explanation,source
C4-026,SLA Chapter 4,Which learning situation could lead to incidental vocabulary learning?,Reading an interesting passage and picking up new words while focusing on meaning,Copying a dictionary page without reading sentences,Counting letters in a word list,Avoiding all authentic input,1,"Source: SLA Chapter 4, pp. 93-103. Incidental learning occurs when the learner’s main task is not memorizing the word itself.",SLA Chapter 4 pp.93-103
C4-027,SLA Chapter 4,Which factor can affect vocabulary learning according to Chapter 4?,"type of word, use of strategies, and frequency of encounters",only the color of the textbook cover,only the learner’s seat number,only the number of exam questions,1,"Source: SLA Chapter 4, p. 111. The points to remember mention frequency, strategies, word type, and prior vocabulary knowledge as relevant factors.",SLA Chapter 4 pp.93-103
C4-028,SLA Chapter 4,Why does Chapter 4 connect lexical skills with production?,Producing sentences requires retrieving words and their usage constraints in real time,Production depends only on handwriting speed,Lexical choice never affects speaking,Only grammar rules are needed for production,1,"Source: SLA Chapter 4, pp. 103-109. The section on using lexical skills discusses production and the role of lexical access in speech.",SLA Chapter 4 pp.103-109
C4-029,SLA Chapter 4,Which issue is most relevant to lexical production?,Selecting a word that fits the intended meaning and syntactic context,Choosing a random sound category,Calculating a standard deviation,Ignoring collocations during speaking,1,"Source: SLA Chapter 4, pp. 103-105. Production requires selecting lexical items that fit meaning, grammar, and context.",SLA Chapter 4 pp.103-109
C4-030,SLA Chapter 4,How does lexical knowledge support sentence comprehension?,It helps listeners and readers identify words and build syntactic and semantic interpretation,It prevents the use of context,It is only used after comprehension is complete,It is unrelated to syntax,1,"Source: SLA Chapter 4, pp. 103-109. The chapter emphasizes that lexical information contributes to comprehension and syntactic interpretation.",SLA Chapter 4 pp.103-109
C4-031,SLA Chapter 4,Which example best shows a lexical constraint on use?,Knowing that a verb can or cannot appear in a particular syntactic pattern,Knowing only the first letter of the verb,Knowing the page number where the verb appears,Knowing that every verb accepts every complement,1,"Source: SLA Chapter 4, pp. 103-109. Lexical knowledge includes usage constraints that affect grammatical patterns.",SLA Chapter 4 pp.103-109
C4-032,SLA Chapter 4,Why is real-time retrieval important for fluent speaking?,The speaker must access words quickly enough to keep the conversation moving,Fluent speaking allows unlimited pauses for every word,Real-time access matters only in reading,Fluency is unrelated to lexical knowledge,1,"Source: SLA Chapter 4, pp. 103-109. The chapter links lexical skills, processing, and production in real time.",SLA Chapter 4 pp.103-109
C4-033,SLA Chapter 4,Which statement matches the chapter’s summary of lexical errors?,Lexical errors are common and can be especially disruptive to communication,Lexical errors are always ignored by listeners,Lexical errors are less relevant than page formatting,Lexical errors never appear in learner corpora,1,"Source: SLA Chapter 4, pp. 110-111. The chapter’s points summarize the communicative importance of lexical accuracy.",SLA Chapter 4 pp.110-111
C4-034,SLA Chapter 4,Which statement best summarizes receptive and productive vocabulary knowledge?,"They are related but not identical, and receptive knowledge is often broader",They are exactly the same construct,Productive knowledge always develops before receptive knowledge,"They are unrelated to form, meaning, and use",1,"Source: SLA Chapter 4, pp. 110-111. The chapter treats vocabulary knowledge as multidimensional and often asymmetric across reception and production.",SLA Chapter 4 pp.110-111
C4-035,SLA Chapter 4,What is one practical implication of formulaic language for speaking practice?,Learners should practice useful chunks that can be retrieved as units,Learners should avoid all multiword phrases,Learners should practice only isolated suffixes,Teachers should remove collocations from input,1,"Source: SLA Chapter 4, pp. 88-93 and pp. 110-111. Formulaic sequences are useful because they can support fluency and naturalness.",SLA Chapter 4 pp.110-111
C4-036,SLA Chapter 4,Which combination best represents “knowing a word”?,"recognizing form, understanding meaning, and using it appropriately",spelling it once and forgetting context,knowing only the Japanese translation,seeing it once in a vocabulary list,1,"Source: SLA Chapter 4, pp. 82-84 and pp. 110-111. Word knowledge includes form, meaning, and use, across receptive and productive dimensions.",SLA Chapter 4 pp.80-111
C4-037,SLA Chapter 4,How does Chapter 4 connect vocabulary learning with the project’s Speaking Review direction?,Chunk and collocation practice can reduce retrieval time during output,Vocabulary should be separated from speaking practice,Only long essays can improve vocabulary use,Speaking practice should ignore lexical constraints,1,"Source: SLA Chapter 4, pp. 88-93 and pp. 103-109. The chapter’s focus on chunks, collocations, and real-time lexical skills supports output-oriented practice.",SLA Chapter 4 pp.80-111
C4-038,SLA Chapter 4,Which activity best targets productive vocabulary knowledge?,Using a target collocation in a spoken sentence under time pressure,Only recognizing the word in a reading passage,Only matching a word with a picture without output,Only reading the dictionary definition silently,1,"Source: SLA Chapter 4, pp. 82-84 and pp. 103-109. Productive knowledge involves active use, especially in real-time speaking or writing.",SLA Chapter 4 pp.80-111
C4-039,SLA Chapter 4,Which activity best targets vocabulary depth?,Choosing the correct collocation and explaining why it fits the context,Counting how many words are on the page,Choosing the longest word in a sentence,Ignoring meaning and focusing only on font size,1,"Source: SLA Chapter 4, pp. 84-93. Depth involves nuanced knowledge such as associations, collocations, and usage constraints.",SLA Chapter 4 pp.80-111
C4-040,SLA Chapter 4,Which design principle follows from Chapter 4 for a learning map?,"Connect concepts, examples, chunks, and output tasks so vocabulary knowledge becomes usable",Keep theory and practice completely separate,Avoid showing source pages,Use only Japanese labels with no examples,1,"Source: SLA Chapter 4, pp. 80-111. The chapter supports a learning map that builds from conceptual understanding to usable lexical output.",SLA Chapter 4 pp.80-111
