id,section,question,correctAnswer,choice1,choice2,choice3,points,explanation,source
C3-001,SLA Chapter 3,Which description best matches L2 phonology in Chapter 3?,Knowledge and use of pronunciation and perception in an L2,The study of paragraph organization only,A theory of classroom motivation,A method for scoring writing rubrics,1,"Source: SLA Chapter 3, pp. 67-68. The section treats L2 phonology as pronunciation and perception, linking listening and speaking to phonological categories.",SLA Chapter 3 pp.67-68
C3-002,SLA Chapter 3,Why can phonological difficulties be especially visible in L2 use?,Learners cannot always avoid producing particular sounds when speaking,Learners can always replace difficult sounds with easier grammar,Phonology has no connection with listening,Pronunciation errors never affect communication,1,"Source: SLA Chapter 3, pp. 67-68. The discussion contrasts phonological problems with syntactic avoidance; sounds often have to be produced in real time.",SLA Chapter 3 pp.67-68
C3-003,SLA Chapter 3,"In a Japanese learner’s pronunciation of “strike” with an extra vowel, which process is illustrated?",Epenthesis,Parameter resetting,Discourse grounding,Lexical priming,1,"Source: SLA Chapter 3, p. 67. Epenthesis refers to adding sounds, often because L1 phonological patterns influence L2 production.",SLA Chapter 3 pp.67-68
C3-004,SLA Chapter 3,What is the main role of the native language in many L2 pronunciation patterns?,It can shape how learners perceive and produce L2 sounds,It prevents all L2 phonological learning,It only affects written vocabulary,It makes all L2 sounds equally difficult,1,"Source: SLA Chapter 3, pp. 67-68. The chapter emphasizes that L1 influence can affect both perception and production in L2 phonology.",SLA Chapter 3 pp.67-68
C3-005,SLA Chapter 3,What sequence best represents the logic of the Speech Learning Model?,"Perception, category formation, and production","Motivation, testing, and grading","Reading, summarizing, and translating","Memorization, forgetting, and rereading",1,"Source: SLA Chapter 3, pp. 68-70. The SLM explains how perceived phonetic similarity affects category formation and later production.",SLA Chapter 3 pp.68-70
C3-006,SLA Chapter 3,"According to the Speech Learning Model, what happens when an L2 sound is perceived as very similar to an L1 sound?",Learners may assimilate it to an existing L1 category,Learners automatically create a new category,Learners stop using the sound entirely,Learners rely only on grammar rules,1,"Source: SLA Chapter 3, pp. 68-70. Similarity can make learners treat an L2 sound as if it belonged to an existing L1 category, which may block a new category.",SLA Chapter 3 pp.68-70
C3-007,SLA Chapter 3,Which example best fits the Speech Learning Model?,An English /r/ sound is difficult because it is mapped onto an existing L1 category,A learner chooses past tense because the event is completed,A learner uses a pronoun because the topic is already given,A learner memorizes a word list for a vocabulary quiz,1,"Source: SLA Chapter 3, pp. 68-70. SLM focuses on phonetic category formation, so examples should involve perception and production of sounds.",SLA Chapter 3 pp.68-70
C3-008,SLA Chapter 3,What does the SLM predict about learning a clearly new L2 sound?,It may be easier to form a new category if the sound is sufficiently different from L1 sounds,It is always impossible after childhood,It depends only on written spelling,It is unrelated to perception,1,"Source: SLA Chapter 3, pp. 68-70. When an L2 sound is clearly different, learners may notice it as a separate sound category.",SLA Chapter 3 pp.68-70
C3-009,SLA Chapter 3,What is the central concern of functional approaches to SLA?,How linguistic forms are used to express meaning and communicative functions,How language is completely independent from context,How teachers should assign grades,How learners memorize isolated definitions,1,"Source: SLA Chapter 3, p. 70. Functional approaches connect form, meaning, and communicative function rather than treating form alone as sufficient.",SLA Chapter 3 p.70
C3-010,SLA Chapter 3,Which statement best contrasts functional approaches with purely formal approaches?,Functional approaches ask what meanings learners are trying to express with forms,Functional approaches ignore meaning,Functional approaches study only phonetic categories,Functional approaches reject all learner data,1,"Source: SLA Chapter 3, p. 70. The functional perspective foregrounds learners’ attempts to map meanings onto linguistic forms.",SLA Chapter 3 p.70
C3-011,SLA Chapter 3,What does the Concept-Oriented Approach investigate?,How learners express a concept before and while acquiring target-like forms,How learners calculate percentile ranks,How learners avoid all communication,How learners memorize alphabet order,1,"Source: SLA Chapter 3, pp. 70-71. This approach starts from a concept such as time, reference, or motion and asks what linguistic means learners use to express it.",SLA Chapter 3 pp.70-71
C3-012,SLA Chapter 3,Which learner example fits a concept-oriented analysis of temporality?,A learner uses adverbs like “yesterday” before consistently using past-tense morphology,A learner answers a multiple-choice reading question,A learner repeats a pronunciation drill with no meaning,A learner chooses a textbook chapter title,1,"Source: SLA Chapter 3, pp. 70-71. Learners may express temporal concepts through lexical devices before fully controlling tense morphology.",SLA Chapter 3 pp.70-71
C3-013,SLA Chapter 3,What does the Aspect Hypothesis mainly claim?,Tense-aspect morphology is acquired in relation to the inherent lexical aspect of verbs,All verbs receive past tense at the same time,Learners never use progressive forms,Pronunciation categories determine tense choice,1,"Source: SLA Chapter 3, pp. 71-73. The hypothesis connects the spread of tense-aspect marking with verb semantics such as state, activity, accomplishment, and achievement.",SLA Chapter 3 pp.71-73
C3-014,SLA Chapter 3,Which verb type is typically associated with early use of progressive -ing?,Activities,States,Achievements only,Abstract nouns,1,"Source: SLA Chapter 3, pp. 71-73. Progressive marking is often associated with dynamic ongoing activities such as running or playing.",SLA Chapter 3 pp.71-73
C3-015,SLA Chapter 3,Which example most clearly expresses an ongoing activity?,A man is playing baseball,A man knows the answer,The door opened suddenly,The meeting ended at noon,1,"Source: SLA Chapter 3, pp. 71-73. An activity can be viewed as ongoing, making it a good context for progressive aspect.",SLA Chapter 3 pp.71-73
C3-016,SLA Chapter 3,Why is “a man was playing baseball” different from “a man played baseball”?,It presents the event as ongoing rather than simply completed,It changes the subject into a plural noun,It removes all temporal meaning,It is a pronunciation difference,1,"Source: SLA Chapter 3, pp. 71-73. The contrast illustrates how aspect changes the way an event is viewed.",SLA Chapter 3 pp.71-73
C3-017,SLA Chapter 3,"In the tense-aspect framework, what is a “state”?","A situation with no inherent dynamic change, such as know or love",A short punctual event such as notice,A process with clear repeated movement only,A discourse device for foregrounding,1,"Source: SLA Chapter 3, pp. 71-73. States differ from activities and achievements because they are not naturally viewed as dynamic events.",SLA Chapter 3 pp.71-73
C3-018,SLA Chapter 3,Which pair best illustrates lexical aspect categories?,state vs. activity,pronunciation vs. spelling,teacher feedback vs. peer feedback,paragraph vs. essay,1,"Source: SLA Chapter 3, pp. 71-73. Lexical aspect classifies verbs and predicates by temporal properties of the situations they describe.",SLA Chapter 3 pp.71-73
C3-019,SLA Chapter 3,What is a prototype effect in tense-aspect learning?,Learners first mark the most typical examples of a form-meaning pairing,Learners always learn rare uses first,Learners ignore verb meaning completely,Learners use only discourse markers,1,"Source: SLA Chapter 3, pp. 73-75. Prototype theory helps explain why learners may acquire central, typical uses before more peripheral uses.",SLA Chapter 3 pp.73-75
C3-020,SLA Chapter 3,Which example would be a prototypical context for past tense marking?,A completed punctual event such as “arrived”,A permanent state such as “knows”,An ongoing activity with no endpoint,A general truth about water,1,"Source: SLA Chapter 3, pp. 73-75. Completed, bounded events are typical contexts where past-tense marking is salient.",SLA Chapter 3 pp.73-75
C3-021,SLA Chapter 3,Why do prototypes matter for teaching tense-aspect?,They help teachers begin with clear form-meaning examples before expanding to less typical uses,They prove that examples are unnecessary,They show that learners should avoid verbs,They remove the need for communicative context,1,"Source: SLA Chapter 3, pp. 73-75. Clear examples can scaffold learners’ understanding before introducing less central cases.",SLA Chapter 3 pp.73-75
C3-022,SLA Chapter 3,Which choice best distinguishes a prototype explanation from a simple memorization account?,It explains why some uses are acquired earlier because they are more central or typical,It says learners randomly memorize all forms,It studies only teacher pronunciation,It focuses only on test scores,1,"Source: SLA Chapter 3, pp. 73-75. Prototype accounts emphasize typicality and gradual extension, not random memorization.",SLA Chapter 3 pp.73-75
C3-023,SLA Chapter 3,What is a key issue in learning futurity?,"Learners must connect future meaning with several possible forms such as will, be going to, or present forms",Learners use only past tense to express future time,Future meaning is never expressed lexically,Only pronunciation controls future reference,1,"Source: SLA Chapter 3, pp. 75-76. Futurity can be expressed through multiple forms, so learners must learn the mapping between form, meaning, and context.",SLA Chapter 3 pp.75-76
C3-024,SLA Chapter 3,Which sentence expresses future reference without using “will”?,I am going to meet her tomorrow,I met her yesterday,I know the answer,I was walking home,1,"Source: SLA Chapter 3, pp. 75-76. Future reference can be expressed with be going to and other structures, not only will.",SLA Chapter 3 pp.75-76
C3-025,SLA Chapter 3,Why can futurity be difficult from a concept-oriented perspective?,The same concept can be expressed by different linguistic forms depending on context,The future has only one fixed form,Learners cannot talk about the future,Future time is unrelated to meaning,1,"Source: SLA Chapter 3, pp. 75-76. A concept-oriented view highlights how learners express a concept with available forms.",SLA Chapter 3 pp.75-76
C3-026,SLA Chapter 3,Which teaching example best supports learning futurity?,"Comparing “will,” “be going to,” and scheduled present uses in meaningful contexts",Practicing only isolated verb spelling,Ignoring time adverbs,Avoiding examples of plans and predictions,1,"Source: SLA Chapter 3, pp. 75-76. Because futurity has multiple forms, contrastive examples can clarify meaning and use.",SLA Chapter 3 pp.75-76
C3-027,SLA Chapter 3,What does the Discourse Hypothesis claim about tense-aspect marking?,Learners’ use of tense-aspect is influenced by discourse structure such as foreground and background,Learners use tense-aspect only according to word length,Tense-aspect is unrelated to narratives,All discourse information is ignored in SLA,1,"Source: SLA Chapter 3, pp. 76-77. The hypothesis links morphology to discourse functions in narratives and other connected texts.",SLA Chapter 3 pp.76-77
C3-028,SLA Chapter 3,"In narrative discourse, what is usually foregrounded?",The main sequence of events that moves the story forward,Background descriptions only,Definitions of isolated vocabulary,Teacher comments about grading,1,"Source: SLA Chapter 3, pp. 76-77. Foreground clauses typically carry the event line, while background clauses provide setting or supportive information.",SLA Chapter 3 pp.76-77
C3-029,SLA Chapter 3,Which sentence is more likely to function as background information?,It was raining when the bus arrived,The bus arrived,She opened the door,He left the room,1,"Source: SLA Chapter 3, pp. 76-77. The background clause sets the scene while the arriving event can move the narrative forward.",SLA Chapter 3 pp.76-77
C3-030,SLA Chapter 3,How does the Discourse Hypothesis extend the Aspect Hypothesis?,It adds discourse organization to explanations based on verb semantics,It rejects all meaning-based explanations,It studies only sound categories,It focuses only on vocabulary size,1,"Source: SLA Chapter 3, pp. 76-77. Both hypotheses are related to tense-aspect, but discourse explanations include the role of narrative structure.",SLA Chapter 3 pp.76-77
C3-031,SLA Chapter 3,Which summary best captures Chapter 3’s functional section?,Learners gradually map meanings and discourse functions onto L2 forms,Learners acquire every morpheme at once,Only classroom tests shape acquisition,Vocabulary knowledge is the only issue in SLA,1,"Source: SLA Chapter 3, pp. 77-78. The summary emphasizes that form, meaning, function, and context all matter for SLA.",SLA Chapter 3 pp.77-78
C3-032,SLA Chapter 3,Which set contains theories from the same Chapter 3 sequence?,"Speech Learning Model, Aspect Hypothesis, and Discourse Hypothesis","Self-determination theory, expectancy-value theory, and flow theory","Schema theory, extensive reading, and genre pedagogy only","Pearson correlation, p-value, and percentile rank",1,"Source: SLA Chapter 3, pp. 77-78. These theories are part of the chapter’s discussion of linguistic and functional approaches to SLA.",SLA Chapter 3 pp.77-78
C3-033,SLA Chapter 3,A learner says “Yesterday I go to school” but uses “I was playing soccer” correctly. What issue is most relevant?,Uneven development of tense-aspect morphology across contexts,A complete lack of communicative ability,A problem only with lexical networks,A percentile-rank interpretation error,1,"Source: SLA Chapter 3, pp. 71-77. Tense-aspect development can be uneven, depending on verb semantics, prototype effects, and discourse context.",SLA Chapter 3 pp.71-77
C3-034,SLA Chapter 3,Which theory best explains difficulty distinguishing L2 sounds because of L1 categories?,Speech Learning Model,Discourse Hypothesis,Aspect Hypothesis,Concept-Oriented Approach to futurity,1,"Source: SLA Chapter 3, pp. 67-70. SLM focuses on phonetic category formation, unlike theories of tense-aspect or discourse.",SLA Chapter 3 pp.67-77
C3-035,SLA Chapter 3,Which theory best explains why learners first use adverbs before target-like tense forms?,Concept-Oriented Approach,Speech Learning Model,Universal Grammar only,Lexical network theory,1,"Source: SLA Chapter 3, pp. 70-71. A concept-oriented analysis tracks how a concept is expressed through available linguistic resources.",SLA Chapter 3 pp.70-77
C3-036,SLA Chapter 3,"Which explanation best connects “played,” “was playing,” and narrative backgrounding?","Tense-aspect choices reflect lexical aspect, viewpoint, and discourse function",They are only spelling differences,They are unrelated to meaning,They can be explained only by vocabulary size,1,"Source: SLA Chapter 3, pp. 71-77. The chapter treats tense-aspect as a form-meaning-discourse system, not merely a memorized suffix.",SLA Chapter 3 pp.71-77
C4-001,SLA Chapter 4,Why does Chapter 4 describe the lexicon as highly important in SLA?,Vocabulary knowledge strongly supports comprehension and production,Vocabulary is less important than punctuation only,Vocabulary errors never affect communication,Lexis is unrelated to grammar or meaning,1,"Source: SLA Chapter 4, pp. 80-82. The chapter gives several reasons: vocabulary supports comprehension, lexical errors can disrupt meaning, and learners need lexical skills for production.",SLA Chapter 4 pp.80-82
C4-002,SLA Chapter 4,What does the train-station example mainly show?,A grammatical error can still be understandable,Lexical errors are always easier than grammar errors,Question formation has no effect on meaning,Native speakers cannot understand grammar errors,1,"Source: SLA Chapter 4, p. 81. The sentence has a grammatical problem but the intended message can still be understood.",SLA Chapter 4 pp.80-82
C4-003,SLA Chapter 4,What does the “suburbs” false-friend example illustrate?,A lexical error can seriously distort intended meaning,All cognates are safe to use,Grammar errors are always more serious,Vocabulary choice is never influenced by L1,1,"Source: SLA Chapter 4, p. 81. The example shows how a word that looks similar across languages can lead to a wrong meaning.",SLA Chapter 4 pp.80-82
C4-004,SLA Chapter 4,"According to Chapter 4, why is oral comprehension especially dependent on lexical skills?",Listeners need lexical information to segment and interpret the speech stream,Listening depends only on written spaces between words,Lexical information is used only after reading,Oral comprehension never involves syntax,1,"Source: SLA Chapter 4, pp. 81-82. The chapter notes that if words cannot be isolated and interpreted, input will not be comprehended.",SLA Chapter 4 pp.80-82
C4-005,SLA Chapter 4,What three broad dimensions does Nation’s framework use for word knowledge?,"form, meaning, and use","motivation, anxiety, and feedback","syntax, discourse, and grading","speed, accuracy, and handwriting",1,"Source: SLA Chapter 4, pp. 82-83. Nation’s framework organizes word knowledge around form, meaning, and use, each with receptive and productive aspects.",SLA Chapter 4 pp.82-84
C4-006,SLA Chapter 4,What is receptive vocabulary knowledge?,"Understanding a word when reading, hearing, or seeing it",Producing a word accurately in speech or writing,Choosing only collocations in a sentence,Memorizing a grammar rule with no context,1,"Source: SLA Chapter 4, p. 82. Receptive knowledge involves comprehension, while productive knowledge involves actual production.",SLA Chapter 4 pp.82-84
C4-007,SLA Chapter 4,What is productive vocabulary knowledge?,"Using a word in speaking, writing, or signing",Only recognizing a word in reading,Only noticing that a word looks familiar,Counting the number of letters in a word,1,"Source: SLA Chapter 4, p. 82. Productive knowledge means learners can actively produce the word in language use.",SLA Chapter 4 pp.82-84
C4-008,SLA Chapter 4,Which knowledge belongs to the “use” dimension of knowing a word?,collocations and constraints on usage,only the first letter of the word,only the translation in L1,only the number of syllables,1,"Source: SLA Chapter 4, pp. 82-83. Use includes grammatical functions, collocations, and constraints on where, when, and how a word can be used.",SLA Chapter 4 pp.82-84
C4-009,SLA Chapter 4,Why does Godfroid propose including reaction times or eye-tracking in vocabulary research?,They show how quickly learners process and produce form-meaning knowledge,They replace the need for any vocabulary theory,They measure only handwriting quality,They prove that vocabulary is learned instantly,1,"Source: SLA Chapter 4, p. 83. Online measures can capture real-time processing and automatization of lexical knowledge.",SLA Chapter 4 pp.82-84
C4-010,SLA Chapter 4,What is a common relationship between receptive and productive vocabulary?,Receptive vocabulary is usually larger than productive vocabulary,Productive vocabulary is always larger from the beginning,The two are completely unrelated,Learners only have productive vocabulary,1,"Source: SLA Chapter 4, pp. 83-84. The chapter describes vocabulary knowledge as a continuum, with receptive knowledge often wider than productive knowledge.",SLA Chapter 4 pp.83-84
C4-011,SLA Chapter 4,What does vocabulary breadth refer to?,How many words a learner knows,How deeply a learner knows one word’s associations and uses,How fast a learner writes an essay,How many pages a learner reads per minute,1,"Source: SLA Chapter 4, pp. 84-85. Breadth concerns vocabulary size or the number of known words.",SLA Chapter 4 pp.84-86
C4-012,SLA Chapter 4,What does vocabulary depth refer to?,"How well a learner knows a word’s meanings, associations, and uses",The number of words recognized in a checklist only,The ability to pronounce only one sound,The time limit of a vocabulary test,1,"Source: SLA Chapter 4, pp. 84-86. Depth concerns quality of knowledge, including meaning relations, collocations, and usage constraints.",SLA Chapter 4 pp.84-86
C4-013,SLA Chapter 4,Why is depth important for comprehension?,Learners need rich semantic and usage knowledge to interpret words in context,Only the number of known words matters,Depth is unrelated to reading and listening,Depth measures only spelling speed,1,"Source: SLA Chapter 4, pp. 84-86. The chapter notes that both breadth and depth can contribute to comprehension.",SLA Chapter 4 pp.84-86
C4-014,SLA Chapter 4,Which example best reflects vocabulary depth?,Knowing that “heavy rain” is natural but “strong rain” is less typical,Knowing that the word “rain” has four letters,Seeing the word “rain” once on a list,Knowing only that “rain” is an English word,1,"Source: SLA Chapter 4, pp. 84-86. Depth includes collocational and usage knowledge, not only recognition.",SLA Chapter 4 pp.84-86
C4-015,SLA Chapter 4,What do word-association studies help researchers investigate?,How words are organized in the learner’s mental lexicon,How learners choose classroom seats,How teachers calculate attendance,How readers format citations,1,"Source: SLA Chapter 4, pp. 86-88. Word associations provide evidence about lexical networks and relationships among words.",SLA Chapter 4 pp.86-88
C4-016,SLA Chapter 4,Which response type would suggest a semantic association?,Responding “doctor” to “hospital”,Responding “because” to “although” only by spelling,Responding with a random number,Leaving the item blank,1,"Source: SLA Chapter 4, pp. 86-88. Semantic associations reveal meaning-based links in lexical networks.",SLA Chapter 4 pp.86-88
C4-017,SLA Chapter 4,Why is morphological knowledge important for vocabulary learning?,"It helps learners understand and produce words through roots, prefixes, and suffixes",It removes the need for meaning,It only measures pronunciation accuracy,It prevents learners from using context,1,"Source: SLA Chapter 4, p. 88. Knowledge of word parts supports both recognition and production of complex words.",SLA Chapter 4 p.88
C4-018,SLA Chapter 4,"In the word “overextended,” what does word-part knowledge involve?","Recognizing components such as over-, extend, and -ed",Ignoring all prefixes and suffixes,Treating the word as only a sound pattern,Using it only as a discourse marker,1,"Source: SLA Chapter 4, pp. 82-83 and p. 88. The chapter uses overextended to illustrate form, meaning, and use, including word parts.",SLA Chapter 4 p.88
C4-019,SLA Chapter 4,What is formulaic language?,Multiword sequences stored or processed as useful units,Any single letter in the alphabet,Only grammar rules without words,A table of statistical values,1,"Source: SLA Chapter 4, pp. 88-93. The chapter discusses formulaic language, collocations, and chunking as important parts of lexical competence.",SLA Chapter 4 pp.88-93
C4-020,SLA Chapter 4,Which example is a multiword unit?,on the other hand,quick,-ed,syllable,1,"Source: SLA Chapter 4, pp. 88-93. Multiword units include recurrent phrases and chunks that function as useful lexical units.",SLA Chapter 4 pp.88-93
C4-021,SLA Chapter 4,Which choice best defines a collocation?,Words that frequently occur together,Words that have opposite spellings,Words that never appear in context,Words arranged alphabetically only,1,"Source: SLA Chapter 4, pp. 88-93. Collocations are regular co-occurrence patterns, which are part of knowing how to use a word.",SLA Chapter 4 pp.88-93
C4-022,SLA Chapter 4,Why can chunking support L2 fluency?,It allows learners to retrieve larger units rather than constructing every word from zero,It forces learners to avoid speaking,It slows down all production,It eliminates the need for vocabulary knowledge,1,"Source: SLA Chapter 4, pp. 88-93. Formulaic sequences can reduce processing burden and support fluent production.",SLA Chapter 4 pp.88-93
C4-023,SLA Chapter 4,What does incidental vocabulary learning mean?,Learning words as a by-product of another activity such as reading,Memorizing a list with the direct goal of vocabulary study,Avoiding unknown words completely,Learning only through pronunciation drills,1,"Source: SLA Chapter 4, pp. 93-103 and p. 110. The points to remember define incidental vocabulary learning as learning that occurs as a by-product of another activity.",SLA Chapter 4 pp.93-103
C4-024,SLA Chapter 4,Why does frequency of encounter matter for vocabulary learning?,"Repeated encounters increase chances of noticing, strengthening, and using word knowledge",One encounter always creates complete mastery,Frequency affects only handwriting,Frequency makes context unnecessary,1,"Source: SLA Chapter 4, pp. 93-103 and p. 111. The chapter summarizes vocabulary learning as incremental and influenced by frequency of encounters.",SLA Chapter 4 pp.93-103
C4-025,SLA Chapter 4,What does it mean that vocabulary learning is incremental?,Word knowledge develops gradually through repeated and recursive encounters,Every word is learned completely at first sight,Learners either know or do not know a word with no middle stages,Vocabulary learning happens only before instruction,1,"Source: SLA Chapter 4, p. 111. The conclusion and points emphasize that vocabulary learning is not instantaneous but develops recursively.",SLA Chapter 4 pp.93-103
